Title,Link,Content
Crowds flock to newest Catholic saint in Assisi — a millennial teen whose ordinariness is the draw,https://apnews.com/article/italy-saint-catholic-millennial-assisi-francis-f3abea4be1c4e57adbe1633733fd671d,"Copyright 2025 The Associated Press. All Rights Reserved. Pilgrims have been pouring into a medieval hilltop town to venerate not only two of the Catholic Church’s most celebrated saints, Francis and Clare, but its newest – Carlo Acutis, the first millennial saint, who will be canonized in a month on April 27. (AP video shot by Chris Warde-Jones) Pilgrims have been pouring into a medieval hilltop town to venerate not only two of the Catholic Church’s most celebrated saints, Francis and Clare, but its newest – Carlo Acutis, the first millennial saint, who will be canonized in a month on April 27. (AP Video: Chris Warde-Jones) A teenager uses a smartphone to take a picture at the tomb of 15-year-old Carlo Acutis, an Italian boy who died in 2006 of leukemia, in Assisi, Italy, on Saturday, March 1, 2025. (AP Photo/Gregorio Borgia) Statuettes of Carlo Acutis, an Italian boy who died in 2006 of leukemia, are displayed for sale in a shop in Assisi, Italy, on Saturday, March 1, 2025. (AP Photo/Gregorio Borgia) Faithful leave the the Church of Santa Maria Maggiore after visiting the tomb of 15-year-old Carlo Acutis, an Italian boy who died in 2006 of leukemia, in Assisi, Italy, on Saturday, March 1, 2025. (AP Photo/Gregorio Borgia) Faithful pay their homage before the tomb of 15-year-old Carlo Acutis, an Italian boy who died in 2006 of leukemia, in Assisi, Italy, on Saturday, March 1, 2025. (AP Photo/Gregorio Borgia) Statuettes of Carlo Acutis, an Italian boy who died in 2006 of leukemia, are displayed in a shop in Assisi, Italy, on Saturday, March 1, 2025. (AP Photo/Gregorio Borgia) Worshippers pay their respects at the tomb of 15-year-old Carlo Acutis, an Italian boy who died in 2006 of leukemia, in Assisi, Italy, on Saturday, March 1, 2025. (AP Photo/Gregorio Borgia) The body of Carlo Acutis, an Italian boy who died in 2006 of leukemia, lies in his tomb in Assisi, Italy, on Saturday, March 1, 2025. (AP Photo/Gregorio Borgia) The body of Carlo Acutis, an Italian boy who died in 2006 of leukemia, lies in his tomb in Assisi, Italy, on Saturday, March 1, 2025. (AP Photo/Gregorio Borgia) The body of Carlo Acutis, an Italian boy who died in 2006 of leukemia, lies in his tomb in Assisi, Italy, on Saturday, March 1, 2025. (AP Photo/Gregorio Borgia) Bishop Domenico Sorrentino speaks during an interview in Assisi, Italy, on Saturday, March 1, 2025. (AP Photo/Gregorio Borgia) Pictures of 15-year-old Carlo Acutis, an Italian boy who died in 2006 of leukemia, are displayed for sale at a kiosk in Assisi, Italy, on Saturday, March 1, 2025. (AP Photo/Gregorio Borgia)                         ASSISI, Italy (AP) — Pilgrims have been pouring into this medieval hilltop town to venerate not only two of the Catholic Church’smost celebrated saints, Francisand Clare, but its newest —Carlo Acutis, the first millennial saint, who will be canonized on April 27. “St. Francis, St. Clare, of course, important saints who marked an epoch – but that’s far removed from today’s teens. Carlo is like the kids,” said Maria Rosario Riccio, a mother and educator who was visiting Acutis’ shrine recently with a 50-strong parish youth group from southern Italy. “He’s a near-saint of our time, who can show teens that it’s possible to love Jesus while being a regular youth.” The group lined up to enter the Santuario della Spogliazione — a somber church, also known as Santa Maria Maggiore, marking the spot where more than 800 years ago St. Francis renounced his family’s wealth. There, they prayed by the monument where Acutis’ body is on view, wearing jeans, a sweatshirt and sneakers. On that Saturday, hundreds filed past — a priest and his parishioners from the Azores islands, a nun from Colombia and her Passionist sisters, a family with two teens from near Venice. Someclutched rosaries, others took selfies or touched the protective glass in front of the seemingly sleeping young man, who died of leukemia at 15 in 2006 and is generating a devotion that astonishes even Assisi’s bishop. “I’m seeing here a volcano of grace erupting … I can’t believe my eyes,” said the Rev. Domenico Sorrentino. When he became bishop two decades ago, the church next to his residence just off the main street was “forgotten” by the throngs that visited the monumental Basilica of St. Francis.  Over the last year, more than a million pilgrims paid homage to Acutis, Sorrentino said, drawn by “his smiling way of living our faith.” The teen’s happy image, usually in a red polo shirt and carrying a backpack, is as popular in souvenir shops across town as Francis in his simple brown habit. One store owner picked up a blessed icon the first time she went to the shrine and keeps it glued to her cash register. “I was really curious about this new saint who attracts youth,” Silvia Balducci said. Both the church and his family describe Acutis as an exceptionally devout but otherwise regular Italian boy, who’s working miracles after his untimely death precisely by drawing youth to faith whenmost of his contemporaries are abandoningorganized religion. “Carlo wasn’t an alien, he was a normal person. But if it’s illuminated by the light of Christ, a life becomes extraordinary,” his mom, Antonia Salzano Acutis, told The Associated Press. “We always pray to the saints, and in the end, what did saints do? They opened the doors of their lives to Christ.” She quoted one of her son’s favorite phrases: “’Everyone is born an original, but many die photocopies.” “The saint is one who didn’t die like a photocopy, who realized that project of holiness that God established in eternity for each of us, as we all should,” she said. Not an observant Catholic herself when she had him, Acutis used to joke with her husband that their young son was “a little Buddha” because of his unselfishness, attention to others, and cheerful obedience. He developed a precocious interest in faith, such as wanting to enter every church to “say hi” to Jesus and Mary. Later, he started attending Mass,adoring the Blessed Sacramentand praying the rosary daily — while also entertaining with jokes his friends who were less interested in religion and more into going to nightclubs with their girlfriends and smoking an occasional joint. “This was a bit of a way of hiding his faith life, because Carlo knew that his friends couldn’t understand,” his mother said. “But Carlo was a witness, a silent witness through the value of friendship, through the value of generosity, helping his classmates in school, defending the teens who were bullied.” Acutis often helped the homeless and was uninterested in the trappings common for a wealthy child in Milan, one of Europe’sfashion and business capitals. He asked his parents to donate to the poor what they would have spent for a second pair of sneakers for him, and insisted he wanted to teach catechism at his parish instead of going on skiing holidays at fancy resorts like his peers. That denial of privilege is a parallel with St. Francis, to whom Acutis was so devoted that he asked to be buried in Assisi, said the Rev. Enzo Fortunato, who spent most of his religious career there and heads the pontifical committee for World Children’s Day. “And there are more similarities with St. Francis. St. Francis left the churches and went to the squares to preach. Carlo Acutis prophetically realized that today the public squares are online, on the Web,” Fortunato said. “That’s where youth are, that’s where people are, so he lives and brings the Gospel in those squares. That’s one of the reasons why he will become the patron of the Web, Internet and social media.” Particularly devout to the eucharist and wanting to share the Catholic belief that Jesus is literally present in it, Acutis created an online exhibit about miracles where the bread and wine became flesh and blood throughout the centuries. It’s been used in thousands of parishes worldwide, his mother said. For her, his being “a bridge to Jesus” — even in his terminal illness, which he faced without complaining, certain of eternal life — is a more important legacy than any miracles or supernatural signs. To become a saint, however,miracles do need to be attested. One in Acutis’ canonization process was the healing of a Costa Rican student from a bicycle accident in Italy after her mother prayed to him, Sorrentino said. Sabina Falcetta goes often to Acutis’ shrine from the nearby city of Perugia with a group of fellow mothers to pray for their children. “Carlo Acutis gives us peace,” she said. “Most importantly he gives us the certainty that God is a good father. And you can’t ask for more.” As she talked outside the sanctuary, a Confirmation group from Lake Garda in northern Italy was praying in a circle by a cutout of Acutis in his jeans and backpack standing by a larger-than-life monstrance. One of the catechists, Veronica Abraham, said she had been teaching about both St. Francis and Acutis, focusing on the teen’s charity and his custom of sitting down to chat with anyone who looked lonely, “since even a ciao is important for those who are alone.” Her son Mario Girardi, 13, said he was really struck by the fact that Acutis — when only a couple of years older than him — “spoke with everyone, didn’t let anything bother him but helped everyone.” While he’s not considering the priesthood, Girardi does go to church every Sunday and plans to “always stay in this mindset” — maybe even going to daily Mass. Would he want to become a saint, too? “Well, let’s hope. Yes, right? Never say never, who knows,” the boy said, grinning. Associated Press religion coverage receives support through the AP’scollaborationwith The Conversation US, with funding from Lilly Endowment Inc. The AP is solely responsible for this content.   Copyright 2025 The Associated Press. All Rights Reserved."
Wisconsin’s governor vetoes a bill that would revive old test score standards,https://apnews.com/article/test-scores-superintendent-wisconsin-bill-republicans-9b07826b723a3e06e1efec745f82ee7d,"Copyright 2025 The Associated Press. All Rights Reserved. Wisconsin Gov. Tony Evers gives the annual State of the State address Wednesday, Jan. 22, 2025, at the state Capitol in Madison, Wis. (AP Photo/Morry Gash, File) MADISON, Wis. (AP) — Democratic Gov. Tony Evers vetoed a Republican-authored bill Friday that would have required state education officials to score standardized student tests according to the scale they used years ago. State schools Superintendent Jill Underly, a liberal who faces conservative Brittany Kinser in Tuesday’s spring election, changed student standardized testing benchmarks and scoring thresholds for school district performance report cards last year. She has said that she made the performance changes at the request of Wisconsin teachers and how they felt their students can perform. Republicans argue the changes watered down standards in an effort to artificially inflate performance grades and made it harder to compare Wisconsin students and districts to their peers around the rest of the country. Evers has said Underly made a mistake because she didn’t cerate a public dialogue about the changes before she imposed them, but online legislative records indicate he vetoed the bill on Friday morning. The governor said in his veto message that while he’s been critical of the process, he objects to legislators trying to undermine the state superintendent’s authority and independence. Evers served as state schools superintendent before he became governor in 2019. The measure would have required education officials to apply performance levels established by the National Assessment of Educational Process when rating the Wisconsin Forward exam, a standardized English and math test.  They also would have had to use terms from the 2021-22 school year to rate student performance on two other standardized tests, the PreACT and ACT with Writing in English, Reading and Mathematics. The categories would be called “below basic,” “basic,” “proficient” or “advanced.” DPI now describes student performance levels as “advanced,” “meeting,” “approaching” and “developing.” The state Department of Public Instruction would have had to use the same scoring system for school district report cards as the agency used during the 2019-20 school year.   Copyright 2025 The Associated Press. All Rights Reserved."
A mayor’s lawsuit shut down a newspaper over fake stories. Now he faces corruption allegations,https://apnews.com/article/everett-mayor-defamation-lawsuit-newspaper-1de803321758f8f907e9faedf16f76aa,"Copyright 2025 The Associated Press. All Rights Reserved. Everett, Mass. Mayor Carlo DeMaria smiles while visiting guests at a senior luncheon following a bingo game at the Connolly Center, Monday, Jan. 13, 2025, in Everett. (AP Photo/Charles Krupa) A selection of Everett Leader Herald News Gazette newspaper stories are displayed at the law firm representing Everett, Mass. Mayor Carlo DeMaria, Friday Dec. 20, 2024, in Boston. (AP Photo/Charles Krupa) Attorney Jeffrey S. Robbins, who is with the firm representing Everett, Mass. Mayor Carlo DeMaria, flips through a folder containing stories by the Everett Leader Herald News Gazette newspaper, Friday Dec. 20, 2024, in Boston. (AP Photo/Charles Krupa) Everett, Mass. Mayor Carlo DeMaria, listens to a reporter’s question during an interview at his attorney’s office, Friday Dec. 20, 2024, in Boston. (AP Photo/Charles Krupa) Everett, Mass. Mayor Carlo DeMaria talks with guests while visiting a senior luncheon following a bingo game at the Connolly Center, Monday, Jan. 13, 2025, in Everett. (AP Photo/Charles Krupa) Everett, Mass. Mayor Carlo DeMaria embraces resident Pamela Mavilio while visiting a senior luncheon following a bingo game at the Connolly Center, Monday, Jan. 13, 2025, in Everett. (AP Photo/Charles Krupa) Two women walk past the Everett Leader Herald News Gazette newspaper, Friday Dec. 20, 2024, in Everett, Mass. (AP Photo/Charles Krupa)               EVERETT, Mass. (AP) — For years, the mayor of a Boston suburb dreaded Wednesdays. That was the day when a local weekly would publish shocking allegations that he was on the take, sexually harassing women or under investigation by the FBI. Friends trashed Everett Mayor Carlo DeMaria on Facebook over what the Everett Leader Herald printed. His father threatened to disown him — over stories the mayor knew were lies. “They labeled me as a ‘Kickback Carlo.’ Accusations that I was settling all kinds of sexual harassment lawsuits, that I put a knife to a girl’s throat and asked for sexual favors,” DeMaria said. “It was awful. It was disgusting.” Almost everything the paper wrote about DeMaria turned out to be fake, enabling him to win a $1.1 million settlement in December that finally shut down the nearly 140-year-old paper. Such defamation victories are exceedingly rare under the Supreme Court’s“actual malice”standard for public figures. That willing disregard for the truth became abundantly evident when the paper’s editor swore in court to tell the truth, and admitted to fabricating story after story in an unrelenting smear campaign. But DeMaria hardly had time to celebrate. Now preparing for his seventh mayoral campaign, he’s been accused of padding his salary with bonus payments — an issue the paper covered four years ago — and this time, the state of Massachusetts is pressing the City Council to take action. Favoring sharp suits and slicked-back hair, DeMaria was schooled in a style of politics based on personal connections with fellow residents in the working-class town of about 49,000 across the Mystic River from Boston. As mayor in 2007, he’s been praised for his leadership in improving infrastructure. Out-of-towners can now look beyond the Monsanto and Exxon Mobil facilities as they come to aglitzy casinoand soon, possibly,a professional soccer stadium.  Everett, Mass. Mayor Carlo DeMaria talks with guests while visiting a senior luncheon following a bingo game at the Connolly Center, Monday, Jan. 13, 2025, in Everett. (AP Photo/Charles Krupa)  Everett voters reelected DeMaria by landslides, and his annual compensation grew to $232,700, including a car allowance and a “longevity bonus,” approaching the $250,000 salary of Mayor Michelle Wu of Boston, a city nearly 14 times larger. Then, after a brutal 2021 campaign, he held onto office by just over 200 votes. Matthew Philbin had bought the Leader Herald in 2017 and hired a Boston-area reporter Joshua Resnek, to turn it into an attack machine, court records show. DeMaria believes Philbin was angry at him after he opposed his boarding house licenses as a councilman and then rejected giving him a city insurance contract after he became mayor. Resnek invented a City Hall insider he called the “Blue Suit” and in article after article, made up conversations accusing “Kickback Carlo” of extorting the city clerk in a land deal, shaking down people for contributions and sexually assaulting women. In an emotional press conference to announce his court victory, DeMaria stood with his wife and expressed vindication. “The size and scope of this settlement — both in terms of the amount that the defendants have agreed to pay and in their agreement to shut down their newspaper — is a reflection of just how egregious their conduct was, and of the volume of their admissions of their misconduct,” DeMaria said. Neither Philbin, Resnek nor their lawyers responded to repeated requests for comment, but the paper’s final edition reported that “the settlement leaves all parties satisfied that an agreeable arrangement was reached, making the necessity of a trial a moot point.” Some residents grumbled aboutthe loss of local news coverage. “We need all kinds of voices,” said Everett homeowner Peggy Serino, a regular at council meetings. “Just because the administration didn’t agree with something doesn’t mean you shut it down.” Someone complained to the state Office of the Inspector General about the bonus payments in 2022, after the Leader Herald suggested they were illegal and quoted a mayoral challenger who called them “greedy.” DeMaria turned down his 2022 payment of $40,000, and the council limited his future payments to what other city workers get — about $1,700 a year. After a lengthy investigation, the Inspector General concluded in February that DeMaria colluded with his finance officer and budget director to retroactively get $180,000 from 2016 to 2021, hiding the payments within other line-items. The IG also concluded that DeMaria may have violated state ethics law by participating in the drafting and approval of the ordinance that padded his pay. The City Council has turned on him since the report came out. It can’t fire him, but councilors demanded repayment and launched an audit into nearly a decade’s worth of payments to him. They also requested details they could bring to the state ethics commission, which can fine an official up to $10,000 per violation and refer evidence of any crimes to prosecutors. DeMaria insists he never “engaged in concealment” and that law enforcement has not contacted him. It’s all just small-town politics, he said. “Those who have falsely accused me over the years are the ones who are guilty of the real wrongdoing,” he said. “I will continue to fight to protect my family, but also to undo the harm that has been done to the reputation of Everett and its residents by these unnecessary and unfounded attacks.” Everett, Mass. Mayor Carlo DeMaria, listens to a reporter’s question during an interview at his attorney’s office, Friday Dec. 20, 2024, in Boston. (AP Photo/Charles Krupa)  DeMaria didn’t attend a special meeting packed with city employees where his lawyer and his daughter came to defend him. Launching his reelection campaign weeks later, he asked supporters to withhold judgment until all the facts come out. Not everyone is willing to wait. The City Council approved a no-confidence vote and ended future longevity payments for him. “This is a sad day for our community,” City Councilor Peter Pietrantonio said. “These are serious facts against the mayor and his administration ... To me, it’s appalling.” Councilor at Large Guerline Alcy Jabouin asked the many city workers supporting DeMaria to look beyond their allegiances. “Think about your property taxes. Think about the school that isn’t getting enough money. Think about your grandmother, your grandfather that cannot afford to pay for their medication,” Jabouin said.   Copyright 2025 The Associated Press. All Rights Reserved."
Shock and surprise at strong earthquake that shook capital of Thailand,https://apnews.com/video/shock-and-surprise-at-strong-earthquake-that-shook-capital-of-thailand-d2d9d690b92b4f62bded074235e31969,"Copyright 2025 The Associated Press. All Rights Reserved. The 7.7 magnitude quake rocked Thailand and neighboring Myanmar, causing possible casualties from a collapsed building in Bangkok. Tourists and residents of Thailand’s capital spoke of their shock and disbelief after the earthquake caused panic in the city. Copyright 2025 The Associated Press. All Rights Reserved."
