Title,Link,Content
How one chef in Vietnam uses fish sauce as the foundation for flavor,https://apnews.com/article/vietnam-chef-fish-sauce-cooking-recipes-2f451335b4da86c453657911303a93bf,"Copyright 2025 The Associated Press. All Rights Reserved. Quang Dung, the chef and owner of Chapter Dining, poses for a photo on March 1, 2025, in Hanoi, Vietnam. (AP Photo/Yannick Peterhans) Dishes made with fish sauce are prepared at Chapter Dining, a fine dining restaurant, on March 1, 2025, in Hanoi, Vietnam. (AP Photo/Yannick Peterhans) Dishes made with fish sauce are prepared at Chapter Dining, a fine dining restaurant, including a water bug, left, on March 1, 2025, in Hanoi, Vietnam. (AP Photo/Yannick Peterhans) Dishes made with fish sauce are prepared at Chapter Dining, a fine dining restaurant, on March 1, 2025, in Hanoi, Vietnam. (AP Photo/Yannick Peterhans) Dishes made with fish sauce are prepared at Chapter Dining, a fine dining restaurant, on March 1, 2025, in Hanoi, Vietnam. (AP Photo/Yannick Peterhans) Dishes made with fish sauce are prepared at Chapter Dining, a fine dining restaurant, on March 1, 2025, in Hanoi, Vietnam. (AP Photo/Yannick Peterhans) A speciality cocktail made with fish sauce is displayed at the Liquid Store, on Feb. 19, 2025, in Hanoi, Vietnam. (AP Photo/Yannick Peterhans) Fish sauce is an indelible part of Vietnam’s culture and essential for its vibrant cuisine. In small fishing villages across Vietnam’s long coast, families have made it for centuries but climate change and overfishing threaten the anchovies crucial for fish sauce production. (AP video shot by Hau Dinh/ production by Annika Wolters)                HANOI, Vietnam (AP) — The taste of banh te — a steamed rice cake with an enticing filling of mushrooms and minced pork — captures the quintessence of northern Vietnamese cuisine: Humble ingredients, prepared perfectly and often enjoyed with a funkyfish saucedip.  This balance of flavors is what Quang Dung, the chef and owner of Chapter Dining in Hanoi, sought in his modern take on the dish. His version of banh te is unapologetically fancy. The steamed rice cake is enriched with pork stock and served with a raw scallop and pickled daikon shavings. Freshness comes from coriander used several ways, sweetness from fried shallot oil, and a delicate floral essence extracted from a giant water bug used in northern Vietnamese cooking.  And then, a splash of fish sauce — or nuoc mam — brings it all together in a savory broth that suffuses the dish.  “Fish sauce is one of the foundations for flavor,” he said. Dishes made with fish sauce are prepared at Chapter Dining, a fine dining restaurant, on March 1, 2025, in Hanoi, Vietnam. (AP Photo/Yannick Peterhans)   It’s also the basis for Vietnam’s diverse and vibrant cuisine. Just a drop of the amber liquid can transform a dish by boosting umami and savory notes. Made by fermenting fish — often anchovies that are getting harder to catch because of climate change — in salt for many months, the taste of each bottle varies depending on factors like the ratio of salt to fish or the length of fermentation.  Fish sauce is a staple across Vietnam, used in a variety of dishes. As a dipping sauce for spring rolls or savory crepes called banh xeo. In marinades for grilled meat dishes like Hanoi’s pork and noodle classic called bun cha. In salad dressings and in braised meat dishes like the southern classic where pork is cooked in bittersweet caramel and fish sauce. Much of Vietnam’s cuisine is shaped by the decades of hardship during and after the Vietnam War, but today its economy and its cities are booming. And fish sauce is finding its way into unusual applications.  A speciality cocktail made with fish sauce is displayed at the Liquid Store, on Feb. 19, 2025, in Hanoi, Vietnam. (AP Photo/Yannick Peterhans)   In Hanoi, fish sauce is used in some cocktails to add umami, and Dung has used it to add a Vietnamese twist to French hollandaise sauce and even flavor ice cream.  “It is very versatile,” he said. “A lot of fun to use and to explore.”  Dung’s culinary explorations began early. His mother taught him to cook at 10 so he could feed himself while his banker parents worked long hours. He learned how to make rice, fry eggs, and boil vegetables. Soon after, he was braising pork and making spicy fried rice. Growing up, he assumed everyone could cook — after all, his friends in Hanoi could. But it wasn’t until he moved to the United Kingdom as a teenager to finish high school that he realized this wasn’t the case.  He eventually studied finance in coastal Devon, but while working part-time in restaurants, he fell in love with all things food: learning from his peers, consuming cookbooks by top chefs, and spending all his savings to eat out at restaurants. “When you’re 18, you’re a sponge. You absorb everything,” he said. Fish sauce is an indelible part of Vietnam’s culture and essential for its vibrant cuisine. In small fishing villages across Vietnam’s long coast, families have made it for centuries but climate change and overfishing threaten the anchovies crucial for fish sauce production. (AP video shot by Hau Dinh/ production by Annika Wolters)  He came back to Vietnam in 2013 and got a job working in a bank. But every evening, he worked a second job — as a junior chef for a five-star hotel in Hanoi at night. He eventually quit both jobs in 2015 and started a gastropub in Hanoi. That didn’t go according to plan as he “managed to do everything wrong.” More failures followed — he calls them “lessons in my dictionary” — but in 2021 he opened Chapter Dining, a fine dining restaurant in the heart of Hanoi’s Old Quarter that celebrates local, seasonal produce and the cooking traditions of Vietnam’s mountainous north.  The restaurant, with its facade of steel slats, leads to an open kitchen where Dung and his team regularly create a 14-course tasting menu that won it a spot in the coveted Michelin Guide Hanoi in 2023 and 2024.  “I can finally call it ... my restaurant, my food, my philosophy,” he said.  Central to that philosophy is sustainability. Each menu is seasonal — warm, comforting dishes for the cold months and fresh, lighter dishes in the summer — and the ingredients are locally sourced. Given the erratic weather in the climate-vulnerable country, this means that he can’t always be sure of what produce will be available. So the menu adapts, letting nature decide, and the bottle of fish sauce is never too far away.  “Fish sauce isn’t just about saltiness. It is as much about umaminess. It is magic,” he said, adding that he hoped more people would cook with fish sauce.  A good starting point, he suggested, is to use it to add a bit of that magic to the humble omelet. Three eggs, two teaspoons of fish sauce, a heap of finely diced spring onions all beaten together. Add pork fat to a hot pan and roll the eggs around.  “And then you’ve got a very nice fish sauce omelet. That goes down really well with rice,” he said.   The Associated Press’ climate and environmental coverage receives financial support from multiple private foundations. AP is solely responsible for all content. Find AP’s standards for working with philanthropies, a list of supporters and funded coverage areas at AP.org.   Copyright 2025 The Associated Press. All Rights Reserved."
Two law firms targeted by Trump sue over executive orders that sought to punish them,https://apnews.com/article/trump-law-firm-mueller-fc64fcda098b52756294c3d6a3b3d998,"Copyright 2025 The Associated Press. All Rights Reserved. President Donald Trump speaks at an education event and executive order signing in the East Room of the White House in Washington, March 20, 2025. (AP Photo/Jose Luis Magana, File) WASHINGTON (AP) — Two prominent law firms targeted bythe White Housesued Friday over virtually identical executive orders, pushing back over edicts meant to punish them over their association with attorneys who have previously investigated President Donald Trump. The federal complaints filed by Jenner & Block and WilmerHale urge judges to block enforcement of the orders, which seek among other sanctions to suspend security clearances of the firms’ lawyers and restrict their employees from having access to federal buildings. The firms say in their lawsuits that the orders, part of a spate of similar actions taken by Trump over the past month, amount to an assault on the bedrock foundations of the legal system and are an unconstitutional form of presidential retaliation. “Our Constitution, top to bottom, forbids attempts by the government to punish citizens and lawyers based on the clients they represent, the positions they advocate, the opinions they voice, and the people with whom they associate,” said the complaint from Jenner & Block, filed in federal court in Washington. The firms say the days-old orders have already affected their business, with Jenner & Block saying that one client has been notified by the Justice Department that the firm cannot attend a meeting at the building next week. “That client therefore will either need to attend the meeting without outside counsel or would need to retain new outside counsel before April 3,” the lawsuit says.  Targeted law firms have taken different approaches to executive orders that threaten to upend their business model and chill their legal practice. Besides the two that sued on Friday,the law firm of Perkins Coie, also challenged the Trump order in court and succeeded in getting a judge to temporarily block enforcement. The Paul Weiss firm, by contrast,cut a deal with the White Housedays after being targeted, with its chairman saying that the order presented an “existential crisis” for the firm and that he wasn’t sure it could have survived a protracted fight with the Trump administration. The executive order against Jenner & Block this week stemmed from the fact that the firm once employed Andrew Weissmann, a lawyer who served onspecial counsel Robert Mueller’s teamthat investigated Trump during his first term in office. Weissmann left the firm four years ago. Mueller has retired from WilmerHale, but the White House executive order from Thursday mentions him as well as another retired partner and a current partner who all served on Mueller’s team. “While most litigation requires discovery to unearth retaliatory motive, the Order makes no secret of its intent to punish WilmerHale for its past and current representations of clients before the Nation’s courts and for its perceived connection to the views that Mr. Mueller expressed as Special Counsel,” the WilmerHale lawsuit says.   Copyright 2025 The Associated Press. All Rights Reserved."
"Memphis Grizzlies fire Taylor Jenkins, franchise’s winningest coach",https://apnews.com/article/memphis-grizzlies-jenkins-fired-coach-074dfaca0d8650b07ef6b4ef70077cf8,"Copyright 2025 The Associated Press. All Rights Reserved. Memphis Grizzlies head coach Taylor Jenkins looks on during the first half of an NBA basketball game against the Utah Jazz, Tuesday, March 25, 2025, in Salt Lake City. (AP Photo/Rob Gray) Memphis Grizzlies guard Ja Morant, middle, watches the game against the Utah Jazz in street clothes during the first half of an NBA basketball game, Tuesday, March 25, 2025, in Salt Lake City. (AP Photo/Rob Gray)     TheMemphis Grizzliesfired Taylor Jenkins, their winningest coach, on Friday with the team struggling down the stretch and at risk of losing home-court advantage for the postseason. Still sitting at No. 5 in the Western Conference standings, the Grizzlies decided to dump Jenkins anyway without immediately announcing an interim coach. Jenkins led the Grizzlies for six seasons. He was let go with the team on the verge of playing three home games in a four-day span starting Saturday — first the Lakers, then Boston on Monday, then Golden State on Tuesday. That starts a stretch where eight of Memphis’ final nine opponents are either playoff clubs or contending for a play-in spot. But it’s still possible, at least mathematically, that Memphis could get back to No. 2 in the West, and it’s highly unlikely that the Grizzlies will fall into the play-in tournament range. Still, Memphis decided it was time for a change. “This was a difficult decision, given the consistent and tangible development of our players and overall success under Taylor’s leadership,” Zach Kleiman, the Grizzlies’ president and general manager of basketball operations, said in a statement. The Grizzlies will not be practicing Friday and announced no media availability. Jenkins was the fifth longest-tenured coach with his current club in the league, behind only San Antonio’s Gregg Popovich, Miami’s Erik Spoelstra, Golden State’s Steve Kerr and Denver’s Michael Malone — all of them having won NBA titles.  Results against the league’s best teams so far this season weren’t a good sign for Jenkins. The Grizzlies were 0-4 against Oklahoma City, losing those games by 24, 13, 17 and 21 points. They’re 3-6 so far this season against Houston, Denver and the Lakers, the next three teams ahead of them in the West. And that’s been a trend all season for Memphis. The Grizzlies were really good against the sub-.500 teams, but struggled mightily against the winning clubs. Against the 13 other teams that currently are over .500, the Grizzlies are 11-20 this season and getting outscored by 77 points. Against the 16 clubs at .500 or worse, the Grizzlies are 33-9, outscoring those opponents by 462 points. Jenkins, with a career record of 250-214, passed Lionel Hollins for most wins in franchise history Nov. 20 with a victory against the Philadelphia 76ers. He also coached the most games in Grizzlies’ history, with the franchise launching in 1995. He took Memphis to the postseason three times during his tenure but only got to the second round once. In the 2021-22 season, the team won 56 games for the Grizzlies’ most in a season under Jenkins. The Grizzlies captured the Southwest Division and were a No. 2 seed in the West. They ousted the Minnesota Timberwolves in the opening round, but lost toGolden State in the secondwith star Ja Morant dealing with an injury. Jenkins replaced J.B. Bickerstaff, who was fired after failing to make the playoffs in the 2018-19 season. He had served as an assistant with the Milwaukee Bucks and Atlanta Hawks, both working for coach Mike Budenholzer. He also served a stint in the San Antonio Spurs organization, eventually becoming head coach of the Spurs G League team in Austin. Jenkins’ arrival in Memphis coincided with the Grizzlies draftingMorantwith the No. 2 overall pick in 2019. Memphis made the postseason three straight seasons from 2021 to 2023. Then the Grizzlies went through a season plagued with injuries to major players. Morant played only nine games because of a25-game league suspensionand aright shoulder injurythat ended his season. Fellow guard Desmond Bane missed considerable time with a left ankle sprain, and frontline reserve Brandon Clarke managed only six games because of a left Achilles tendon tear. That left Jenkins to manage the season with forward Jaren Jackson Jr. and a bunch of makeshift lineups, eventually finishing 27-55. This season, Jenkins turned over his coaching staff and brought in a new offense based on spacing. Despite being plagued with turnovers, Memphis spent a large part of the season second in the West. Other teams surged as the Grizzlies’ rough patch dropped them to fifth place. Again, Jenkins spent another season piecing together lineups around Morant limited to 43 games with various illnesses, soreness, contusions and sprains. Morant missed Thursday night’s game,his sixth straight, with a strained hamstring. AP Basketball Writer Tim Reynolds and AP freelance writer Clay Bailey contributed to this report. AP NBA:https://apnews.com/hub/nba   Copyright 2025 The Associated Press. All Rights Reserved."
IRS crime fighting arm announces modernization program as financial crimes use more tech,https://apnews.com/article/bank-secrecy-act-irs-criminal-investigations-342ea3261a0c62901b854fd29ecdc580,"Copyright 2025 The Associated Press. All Rights Reserved. A sign for the Internal Revenue Service building in Washington, on May 4, 2021. (AP Photo/Patrick Semansky, File) WASHINGTON (AP) — As the nature offinancial crimechanges, with technology and AI increasingly used to perpetrate illegal acts, the IRS’ crime fighting arm —IRS Criminal Investigation— is announcing a new program intended to improve how it interacts with financial institutions. Called Feedback in Response to Strategic Threat —or CI-FIRST— the program unveiled Friday is intended to speed up subpoena requests, give banks better data on how to detect criminal activity and build out investigations faster and more efficiently. Under theBank Secrecy Act, banks and financial institutions are required to send over a variety of suspicious activity reports to the federal government after detecting potential money laundering or terrorist financing. The goal for CI-FIRST is to help financial institutions more easily detect and report financial crimes tied to fentanyl trafficking, drug trafficking, human smuggling and other crimes — by streamlining subpoena requests and improving data-sharing with banks. IRS-CI Chief Guy Ficco said in a statement that “public-private partnerships thrive when everyone mutually benefits.” Also on Friday, IRS Criminal Investigation released new statistics highlighting how the agency has investigated financial crimes using Bank Secrecy Act data. The agency found $21.1 billion in fraud tied to tax and financial crimes from 2022 to 2024, seized $8.2 billion in assets tied to criminal activity in the same period, and recouped $1.4 billion in restitution for crime victims, according to the agency.  “Behind all of these metrics are real crimes with real victims,” said Lauren Kohr, IRS-CI’s strategic engagement adviser. “A lot of times people look at BSA data or the Bank Secrecy Act as a regulatory requirement, but it’s really one of the sharpest tools law enforcement as a whole has to trace fraud illicit money and dismantle these criminal networks.” “And when illicit money moves, it’s these BSA reports,” she said “that tell us the story.” IRS-CI special agents ran an average of 966,900 searches annually against currency transaction reports. A currency transaction report, or CTR, is a financial document that banks are required to file with Treasury for any cash transaction exceeding $10,000 in a single day. In the past three years, roughly 67% of cases opened by IRS-CI involved one or more currency transaction reports below $40,000, with half of currency transaction reports involving amounts less than $22,230. Despite the majority of reports coming in below $40,000, a group of Republican lawmakers is pursing raising the threshold. Georgia Rep. Barry Loudermilk and nine other House Republicans have sponsored a bill called the Financial Reporting Threshold Modernization Act, which would raise the currency transaction reporting and Suspicious Activity Reporting thresholds to $30,000 and $10,000, respectively, and index the CTR threshold for inflation every five years. On April 1, the House Financial Services Subcommittee on National Security, Illicit Finance, and International Financial Institutionswill hold a hearingon April 1 and the issue of CTR thresholds will come up. Last December a Government Accountability Office report recommended Treasury help to “reduce the number of CTRs filed that are not used by law enforcement,such as by raising the reporting thresholdor expanding criteria to allow for further exemptions.” In addition to their financial crimes work, IRS Criminal Investigations has been called upon by the Trump administration to help with immigration enforcement. Last month, Homeland Security Secretary Kristi Noemsent a request to Treasury Secretary Scott Bessent to borrow IRS Criminal Investigation workersto help with the immigration crackdown, according to a letter obtained by The Associated Press. It cites the IRS’s boost in funding, through the $80 billion infusion of funds the federal tax collection agency received under the Democrats’ Inflation Reduction Act hasalready been clawed back.   Copyright 2025 The Associated Press. All Rights Reserved."
