Title,Link,Content
Musk announces $1 million for Wisconsin voter in Supreme Court race. Opposition calls it ‘corrupt’,https://apnews.com/article/wisconsin-supreme-court-elon-musk-lottery-trump-b272e6af6c18ff5b73cd100ecec275b7,"Copyright 2025 The Associated Press. All Rights Reserved. Elon Musk, left, shakes hands with President Donald Trump at the finals for the NCAA wrestling championship, Saturday, March 22, 2025, in Philadelphia. (AP Photo/Matt Rourke) Wisconsin Supreme Court candidates Brad Schimel and Susan Crawford participate in a debate Wednesday, March 12, 2025, in Milwaukee. (AP Photo/Morry Gash) Wisconsin Supreme Court candidates Brad Schimel and Susan Crawford participate in a debate Wednesday, March 12, 2025, in Milwaukee. (AP Photo/Morry Gash) Elon Musk attends a cabinet meeting at the White House in Washington, Monday, March 24, 2025. (Pool via AP)         ▶ Follow live updates onPresident Donald Trump and his administration MADISON, Wis. (AP) — Billionaire Elon Musk says a Wisconsin voter has been awarded $1 million days before the conclusion of afiercely contested state Supreme Court electionthat has broken spending records and become areferendum on Musk and the first monthsof President Donald Trump’s administration. The payment to a Green Bay man, which Musk announced Wednesday night on his social media platform X, is similar to a lottery that Musk’s political action committee ran last year in Wisconsin and other battleground states before the presidential election in November. The upcoming election on Tuesday, filling a seat held by a liberal justice who is retiring, will determine whether Wisconsin’s highest court will remain under 4-3 liberal control or flip to a conservative majority. The race has becomea proxy battleover the nation’s politics, with Trump and Muskgetting behindBrad Schimel, the Republican-backed candidate in the officially nonpartisan contest. The campaign for the Democratic-supported candidate, Susan Crawford, blasted the $1 million payment from Musk as an attempt to illegally buy influence on the court in a state where Tesla, his electric car company, has alawsuit pendingthat could end up before the court. “It’s corrupt, it’s extreme, and it’s disgraceful to our state and judiciary,” Crawford spokesperson Derrick Honeyman said in a statement.  No legal action against Musk’s payments to voters has been filed in Wisconsin with the Supreme Court election five days away. Jay Heck, executive director of Common Cause in Wisconsin, said the payments were a last-minute attempt to influence the election. “Whether or not Wisconsinites will believe this is legitimate or not probably won’t be settled until after the election,” he said. “But this not what a Wisconsin Supreme Court election ought to be decided on. Races for the high court are supposed to be on judicial temperament and impartiality, not huge amounts of money for partisan purposes.” Musk’s political action committee, America First, announced last week that it wasoffering $100 to voterswho signed a petition in opposition to “activist judges.” He did not say there would be $1 million prizes at that time, but in hispost on Wednesdaysaid an additional $1 million award would be made in two days. It was not clear who determined the winner of the $1 million or how it was done. Musk’s political action committee useda nearly identical tacticbefore the White House election last year,offering to pay$1 million a day to voters in Wisconsin and six other battleground states who signed a petition supporting the First and Second Amendments. It is a felony in Wisconsin to offer, give, lend or promise to lend or give anything of value to induce a voter to cast a ballot or not vote. The Musk petition says it is open only to registered Wisconsin voters, but those who sign it are not required to show any proof that they actually voted. The petition says: “Judges should interpret laws as written, not rewrite them to fit their personal or political agendas. By signing below, I’m rejecting the actions of activist judges who impose their own views and demanding a judiciary that respects its role — interpreting, not legislating.” The petition, while designed to collect data on Wisconsin voters and energize them, also is in line withTrump’s agendaalleging that “activist” judges are illegally working against him. Trump’s administration is embroiled in several lawsuits related to his flurry of executive orders and Musk’s Department of Government Efficiency effort todownsize the federal bureaucracy. During last year’s presidential race, Philadelphia’s district attorney sued in an attempt to stop the payments under Pennsylvania law. But a judge said prosecutorsfailed to showthe effort was an illegal lottery and allowed it to continue through Election Day. America PAC and Building for America’s Future, two groups that Musk funds, have spent more than $17 million trying to help elect Schimel, according to a tally by the Brennan Center for Justice. Musk also has given the Wisconsin Republican Party $3 million this year, which it can then give to Schimel or spend on the race. More than $81 million has been spent on the race so far, obliterating the record for a judicial race in the U.S. of $51 million set in Wisconsin just two years ago, according to Brennan Center tallies.   Copyright 2025 The Associated Press. All Rights Reserved."
Top 20 Global Concert Tours from Pollstar,https://apnews.com/entertainment/top-20-global-concert-tours-from-pollstar-ee73eba617605529f372bbb4d687b40d,"Copyright 2025 The Associated Press. All Rights Reserved. The Top 20 Global Concert Tours ranks artists by average box office gross per city and includes the average ticket price for shows Worldwide. The list is based on data provided to the trade publication Pollstar by concert promoters and venue managers. For free upcoming tour information, go towww.pollstar.com   Copyright 2025 The Associated Press. All Rights Reserved."
Mississippi governor signs typo tax overhaul bill into law to phase out income tax,https://apnews.com/us-news/taxes-tate-reeves-mississippi-general-news-573ad75c52cb94af8f8adc90d1cd5e96,"Copyright 2025 The Associated Press. All Rights Reserved. Gov. Tate Reeves signed a bill to overhaul Mississippi’s tax system — one that many lawmakers inadvertently voted for because of typos — into law on Thursday. This sets Mississippi on a path to become the first state to eliminate an existing income tax, when the tax is phased out in about 14 years. Reeves said the law marks a turning point in the state’s history and that it would make Mississippi a magnet for corporate investment and workers from other states. “Today is a day that will be remembered not just for the headlines, not just for the politics, but for the profound generational change it represents,” Reeves said at a bill signing ceremony in front of the Governor’s Mansion. “I must say, it feels like it’s been a long time coming, but after many, many, many years of hard work, we can all stand together and say that we have accomplished income tax elimination in the state of Mississippi.” Mississippi is currently reducing its income tax rate to 4% from a previously passed tax cut being phased in. Beginning in 2027, the new law will reduce that rate by .25% over four years until it reaches 3%. In 2031, the tax will only be reduced if certain revenue “growth triggers” are met. The law also reduces the sales tax on groceries from 7% to 5%, raises the gasoline tax from 18.4 cents a gallon to 27.4 cents a gallon over three years to fund infrastructure and changes the contribution model of the public employee retirement system.  House leaders have long pushed to eliminate the state personal income tax in relatively short order. The Senate had urged a longer-term approach, arguing it would be unwise to slash a third of the state’s revenue in uncertain economic times. Senators last week had conceded to eliminate the income tax, but only with economic growth “triggers” as safeguards — the tax wouldn’t phase out unless the state saw robust economic growth and controlled spending. It would have likely taken many years. Or so they thought. The Senate bill had typos that essentially nullified the growth triggers and would eliminate the income tax nearly as quickly as the House proposed. The House passed the flawed bill on to the governor, who signed it into law Thursday. In a social media post last week, Reeves, who did not mention the bizarre series of events that helped send the bill to his desk, said “liberal activists” were “making claims of errors, omissions, mistakes, and changes.” Since then, both House Speaker Jason White and Lt. Gov Delbert Hosemann, both Republicans, have acknowledged the legislation signed into law Thursday contained errors. Hosemann downplayed the typos at the ceremony. “Some of y’all are focused on a typo in the bill, and I’d use the biblical analogy, let he who has not had a typo cast the first stone.” Reeves said the tax overhaul will lead to economic dynamism and attract new residents to Mississippi, but local officials and experts remain divided on whether eliminating the tax will actually benefit the state’s economy and whether citizens will reap many of the benefits that politicians claim they will. Neva Butkus, a senior analyst at the Institute on Taxation and Economic Policy, said her projections show that once Mississippi abolishes its income tax, it will likely result in a $2.6 billion reduction to the current $7 billion general fund budget, revenue that the poorest state in the nation could use to provide core government services. “What the state is essentially committing to is a very extreme and dramatic loss of revenue during a very tumultuous time during which the state might be reckoning with large federal cuts to social programs that many Mississippians rely on,” Butkus said. “And they’re doing all of this while creating a windfall for the state’s wealthiest residents in the poorest state in the union.” Mississippi’s decision to eliminate the tax without raising another tax to offset the general fund loss comes as President Donald Trump’s administration and the GOP-controlled Congress are considering sweeping budget cuts and freezing federal grants that fund many state services. Mississippi’s economy and budget are among the most reliant on federal spending in the nation. If the federal government significantly slashes any federal programs, the impact will almost certainly trickle down to the state level. The ITEP’s data shows that Mississippians who make less than $19,300 a year, the poorest of the poor, already spend around 12.4% of their income on taxes. In comparison, Mississippians who make over $362,000 annually only contribute 6.9% of their income to taxes. Once the tax cuts take full effect, Butkus said that disparity is expected to widen even more, especially since the new law will raise the gasoline tax by 9 cents a gallon to fund road and bridge infrastructure. “When you’re replacing progressive income taxes with regressive revenue, that becomes a problem,” Butkus said. Conversely, Joe Bishop-Henchman, the executive vice president of the National Taxpayers Union Foundation, believes the law’s growth triggers — even with the errant decimal point typos defanging them — mean the state can responsibly eliminate the tax without decimating its budget. Bishop-Henchman has previously testified before the state Legislature about tax policy and said it would be ideal for lawmakers to correct the typos in the trigger language, but having some type of guardrails in place is something multiple states have enacted. “A value of triggers is that it still leaves room for budget growth,” Bishop-Henchman said. Mississippi Today spoke to mayors around the state, who were also divided on some elements of the overhaul. Shari Veazey, executive director of the Mississippi Municipal League, a lobbying organization that represents cities and towns, said the entity did not oppose the bill signed by Reeves because it diverts more state money from the sale tax on groceries to localities, even though the overall sales tax rate on groceries was reduced. “The number one priority was just making sure there was no loss of revenue when they reduced the grocery sales tax,” Veazey said. “And we don’t believe there will be.” Veazey said the impact on municipalities of shrinking the state general fund budget remains to be seen. Starkville Mayor Lynn Spruill said she had been assured by the area’s state legislators that city budgets would be kept afloat. “The proof will be in the numbers we receive when it goes into effect,” Spruill said. “I’m relying on our legislators being accurate.” She said cuts to the general fund might not have a big impact on her city’s ability to function, but individual taxpayers might have cause for concern. “I would worry about it as a resident who pays taxes, as to what that will do to the basic services the state provides,” Spruill added. “But as it relates to a direct appropriation to the city, that’s not something I’m particularly concerned about.” The gas tax increase could cause some financial hardship, Spruill said. But Starkville, home to Mississippi State University, has better public transportation than most cities in the state. But in a place such as Greenville, located in the rural, poverty-stricken Mississippi Delta, some worry a slashed general fund alongside gas tax increases could make it more expensive to drive and weaken local government’s ability to provide basic services. “The trickle-down negative effects of this tax overhaul will not actually trickle down—it will be a huge take-away from this rural community,” said Greenville Mayor Errick Simmons. “When local governments lose the ability to fund police, fire, and other essential services, the safety and well-being of our residents are put at risk.” In Greenwood, located at the eastern edge of the Delta, Mayor Carolyn McAdams, said she was concerned that the law’s increased grocery sales tax diversion might not be enough to make up for revenue small towns might lose. “The people in these small towns like Itta Bena, Sidon, Schlater only have these convenience stores and they don’t even have grocery stores. What is that going to do to these small towns?” McAdams said. “I have to trust that they’re going to take all of that into consideration and not do anything that would be harmful to the cities and towns that make up Mississippi.” Reeves said the benefits would outweigh the costs: “We are saying to entrepreneurs, to workers, to dreamers: Mississippi is open for business, and we will not penalize your success. We are going to compete and we are going to win.” This story was originally published byMississippi Todayand distributed through a partnership with The Associated Press.   Copyright 2025 The Associated Press. All Rights Reserved."
What is ‘classified’ information? What are ‘secure’ communications? Here’s a primer,https://apnews.com/article/trump-hegseth-yemen-houthis-signal-gabbard-ratcliffe-d6f8525a784233552b480676092bcc92,"Copyright 2025 The Associated Press. All Rights Reserved. Director of National Intelligence Tulsi Gabbard, center, is flanked by FBI Director Kash Patel, left, and CIA Director John Ratcliffe, as the Senate Intelligence Committee holds its worldwide threats hearing, on Capitol Hill in Washington, Tuesday, March 25, 2025. (AP Photo/J. Scott Applewhite) Director of National Intelligence Tulsi Gabbard, left, joined by CIA Director John Ratcliffe, testifies as the House Intelligence Committee holds a hearing on worldwide threats, at the Capitol, in Washington, Wednesday, March 26, 2025. (AP Photo/J. Scott Applewhite)     WASHINGTON (AP) — The Trump administration’s use of a popular messaging app to discuss sensitive military plans — with a journalist onthe text chain— israising questionsabout security and the importance of safeguarding the nation’s secrets. It’s also highlighting the differences between classified and public information, and demonstrating that even encrypted apps like Signal can lead to embarrassing leaks if the humans doing the texting don’t follow basic security tips. President Donald Trump’sadministration says no classified material was leakedwhen senior officials used Signal to discuss upcoming attack plans against the Houthi rebels in Yemen — even though a journalist was on the chat. But even if the information had been declassified by the Pentagon, it contained details that would have been highly valuable to the Houthis or other adversaries, showing how sometimes the decision of what to classify is a judgment call. The federal government routinely classifies vast amounts of information pertaining to military and intelligence operations. The material ranges from top secret nuclear programs or the identities of undercover agents all the way to mundane records that would be of little interest to anyone, let alone America’s adversaries. In 2011, for example, the CIA finally declassified itsrecipe for invisible ink— from 1917. Advocates for open government have long complained that the push for secrecy goes too far, by protecting information that could shine a light on government activities or matters of public interest, including aboutUFO sightingsand a60-year-old presidential assassination.  While the public typically calls any information withheld by the government “classified,” that term only refers to the three broad categories used to “classify” information based on the need for secrecy: confidential, secret and top secret. While files marked “confidential” contain information that’s not meant to be released, the need for security or access restrictions isn’t as great as for material considered “top secret,” which includes the nation’s nuclear secrets and other material that, if released, could pose a grave danger to national security. While the Pentagon hasn’t offered classification details about the information in the Signal chats, information about upcoming military strikes is typically tightly guarded to ensure adversaries don’t have advance warning that could jeopardize the mission or put American service members at risk. The Pentagon closely guards even some publicly available information. Material categorized as “controlled unclassified information,” while not secret, is still considered sensitive enough that military service members are prohibited from discussing it on unsecured devices like personal phones. Director of National Intelligence Tulsi Gabbard and CIA Director John Ratcliffe were asked about that policy during a Senate hearing this week as they were grilled over the Signal chat. Democratic Sen. Mark Kelly of Arizona noted that Department of Defense policy “prohibits discussion of even what is called controlled unclassified information on unsecured devices,” and asked if Ratcliffe and Gabbard, who oversees the nation’s 18 intelligence agencies, were aware of that rule. “I haven’t read that policy,” Gabbard said. “I’m not familiar with the DOD policy,” Ratcliffe said. The power to classify or declassify lies in the hands of top federal officials, including the president and Cabinet secretaries. For military information like the attack plans discussed over Signal, the power lies with Defense Secretary Pete Hegseth, who has faced demands that he resign over the leak. The president’s ability to declassify information has been invoked when presidents have been accused of mishandling secrets. Trump ally Kash Patel, now the FBI director, hassaid he witnessed Trump declassify materialthat was taken after his first term to the president’s Trump’s Mar-a-Lago resort, but no evidence has emerged to support that claim. The Pentagon hasn’t said whether Hegseth declassified the attack plans before or after the Signal conversation, but Ratcliffe, Gabbard and the White House have all said the chats contained no classified information. “I haven’t participated in any Signal group messaging that relates to any classified information at all,” Ratcliffe proclaimed at one point. That explanation has failed to satisfy Democrats who say that plans for imminent military strikes are regularly classified. National security experts agree. They say it would be highly unusual for the Pentagon to publicize such information and that any lower-level officer caught leaking such material on Signal would face serious repercussions. For many consumers, encrypted apps likeSignalcan offer greater protections for everyday conversations. But that doesn’t mean they’re secure enough for government secrets, or immune to human error, as the inclusion of a reporter on the text chain shows. Senior federal officials who handle classified data receive extensive training about the need to use approved devices and platforms to discuss government secrets. Intelligence and national security agencies have whole departments devoted to cybersecurity and the protection of state secrets. Government cybersecurity officials haverecommendedthat federal employees use encrypted apps like Signal, which can offer greater security for routine communication, and Ratcliffe said this week it was a “permissible” app for senior officials to use. But the app is only as secure as the device it’s downloaded onto. The government’s most sensitive information is typically discussed in a facility known as a sensitive compartmented information facility, or SCIF, which is designed to allow officials to review or discuss secrets without fear of eavesdropping or cyber intrusion. Any senior official using a personal device to discuss classified material could be at risk of cyberespionage, said Michael Williams, an expert on international relations and national security at Syracuse University. “Signal may be encrypted, but it’s the devices that are really the issue,” Williams said. “All of these people are being targeted.”   Copyright 2025 The Associated Press. All Rights Reserved."
Cuba had record 26 players on opening-day MLB rosters and Japan had 12 for its most since 2012,https://apnews.com/article/mlb-international-players-cuba-ab72db7526b38b7f8a70474cc2f6e398,"Copyright 2025 The Associated Press. All Rights Reserved. Los Angeles Angels’ Yoan Moncada (5) and Jorge Soler walk to the dugout during the second inning of a spring training baseball game against the Cincinnati Reds, Wednesday, Feb. 26, 2025, in Tempe, Ariz. (AP Photo/Matt York) NEW YORK (AP) — Cuba had a record 26 players on Major League Baseball’s opening day rosters and Japan had 12 for its most since 2012. The percentage born outside the 50 states remained at 27.8%, matching its lowest level since 2016. There were 265 players from 18 nations and territories outside of the 50 states among 954 players on opening day active rosters and injured, restricted and inactive lists, the commissioner’s office said Friday. Cuba’s total topped its previous high of 23 in 2016, 2017 and 2022. Japan’s total was its most since 13 in 2012. The overall percentage matched last year and was down 28.5% in 2023, which was the lowest since 27.5% in 2016. It has remained in the 26-29.8% range since 2002, peaking in 2017. The total international players was the fourth-highest behind 291 in 2020 (when there were expanded 30-man active rosters), 275 in 2022 (when there were expanded 28-man active rosters) and 270 in 2023. The Dominican Republic led countries outside the U.S. with 100, down from 108 last year and 110 in 2020. Canada’s 13 matched last year for its most since 17 in 2013. Venezuela was second at 63, followed by Cuba (26), Puerto Rico (16), Canada (13), Japan (12), Mexico (11), Curacao and Panama (four), South Korea (three), Aruba, Australia and Colombia (two) and Bahamas, Brazil, Germany, Honduras, Nicaragua and South Africa (one apiece). Atlanta catcher Chadwick Tromp joined San Diego infielder Xander Bogaerts to give Aruba two players for the first time.  San Francisco’s Jung Hoo Lee and Philadelphia’s Jesús Luzardo were listed as miscellaneous, Lee as born in Japan of South Korean descent and Luzardo as born in Peru of Venezuelan descent. Houston and San Diego topped teams with 16 international players each, with the Astros having a share of the lead for the fifth straight season. They were followed by Atlanta (14), the New York Mets (13) and Baltimore and Miami (12 each). The 18 nations and territories outside the U.S. matched last year and were three shy of the high, set in 2018 and matched in 2022. AP MLB:https://apnews.com/hub/mlb   Copyright 2025 The Associated Press. All Rights Reserved."
